{
  "actions": {
    "describe_src": [
      "python",
      "tools/describe_src.py",
      "--n",
      "10"
    ],
    "src_fuzz": [
      "python",
      "tools/src_fuzz_mutation.py"
    ],
    "src_replay": [
      "python",
      "tools/src_replay.py"
    ],
    "test": [
      "python",
      "-m",
      "pytest",
      "-q",
      "--junitxml",
      "evidence/tests.junit.xml"
    ]
  },
  "base_ref": "origin/main",
  "budgets": {
    "diff_budget": {
      "max_files_changed": 80,
      "max_lines_changed": 2000
    },
    "iteration_budget": 2,
    "time_minutes": 60
  },
  "component": "xtrl",
  "constraints": {
    "allowed_paths": [
      "**"
    ],
    "clean_repo_required": true,
    "deny_repo_local_roots": [
      ".codex",
      ".quint"
    ],
    "forbidden_paths": [],
    "forbidden_patterns": [
      "subprocess\\.run\\(.*shell\\s*=\\s*True",
      "os\\.system\\(",
      "eval\\(",
      "exec\\("
    ]
  },
  "evidence": {
    "required_files": [
      "evidence/plan.md",
      "evidence/decision.md",
      "evidence/scope.json",
      "evidence/integrity.json",
      "evidence/tests.junit.xml",
      "evidence/regression.md",
      "evidence/events.jsonl",
      "evidence/dep_graph.json",
      "evidence/api_surface.json",
      "evidence/module_manifest.json",
      "evidence/src_state.json",
      "evidence/src_state.md",
      "evidence/src_replay_report.json",
      "evidence/src_replay_report.md",
      "evidence/src_fuzz_mutation_report.json",
      "evidence/src_fuzz_mutation_report.md",
      "commands.log",
      "summary.md",
      "packet.json",
      "contract.json",
      "exec-prompt.md"
    ]
  },
  "inputs": {
    "notes": [
      "If Phase E is optional, do not gate milestone completion on this packet.",
      "Snapshots are emitted as evidence/dep_graph.json, evidence/api_surface.json, evidence/module_manifest.json.",
      "describe_src emits evidence/src_state.{json,md} with lineage pointers.",
      "Replay validation emits evidence/src_replay_report.{json,md}.",
      "Mutation fuzz emits evidence/src_fuzz_mutation_report.{json,md} with stable reason codes."
    ]
  },
  "mode": "loop",
  "packet_id": "pkt-loop-0011-src-lineage-validation-spine",
  "plan_card": {
    "how": "AST snapshots + lineage pointers; replay validation + mutation fuzz with bounded budgets.",
    "what": "describe_src + replay + mutation fuzz with stable reason codes.",
    "when": "CHECK",
    "where": "tools/describe_src + validation harness",
    "who": "xtrl runner",
    "why": "Optional deterministic src lineage + validation spine."
  },
  "repo": "xtrl",
  "schema_version": "xtrl.pre_contract/v0.2"
}
