{
  "actions": {
    "linearizer_replay": [
      "python",
      "tools/linearizer_replay.py"
    ],
    "test": [
      "python",
      "-m",
      "pytest",
      "-q",
      "--junitxml",
      "evidence/tests.junit.xml"
    ]
  },
  "base_ref": "origin/main",
  "budgets": {
    "diff_budget": {
      "max_files_changed": 50,
      "max_lines_changed": 1500
    },
    "iteration_budget": 2,
    "time_minutes": 60
  },
  "component": "xtrl",
  "constraints": {
    "allowed_paths": [
      "**"
    ],
    "clean_repo_required": true,
    "deny_repo_local_roots": [
      ".codex",
      ".quint"
    ],
    "forbidden_paths": [],
    "forbidden_patterns": [
      "subprocess\\.run\\(.*shell\\s*=\\s*True",
      "os\\.system\\(",
      "eval\\(",
      "exec\\("
    ]
  },
  "evidence": {
    "required_files": [
      "evidence/plan.md",
      "evidence/decision.md",
      "evidence/scope.json",
      "evidence/integrity.json",
      "evidence/tests.junit.xml",
      "evidence/regression.md",
      "evidence/events.jsonl",
      "evidence/candidate_index.json",
      "evidence/promotion_lock.json",
      "evidence/replay_report.json",
      "evidence/replay_report.md",
      "commands.log",
      "summary.md",
      "packet.json",
      "contract.json",
      "exec-prompt.md"
    ]
  },
  "inputs": {
    "notes": [
      "Candidate aggregation must be concurrency-safe and deterministic.",
      "Record candidate IDs, base_sha used, and stale filtering in evidence/candidate_index.json.",
      "Record lock acquisition and base head before/after in evidence/promotion_lock.json.",
      "Linearizer must replay patch on clean base and deny on PATCH_APPLY_FAILED.",
      "Emit replay report under evidence/replay_report.{json,md}."
    ]
  },
  "mode": "loop",
  "packet_id": "pkt-loop-0009-linearizer-replay",
  "plan_card": {
    "how": "Replay patch on clean base; deny PATCH_APPLY_FAILED; single-writer lock; stale base filtering.",
    "what": "Implement concurrency-safe candidate aggregation and authoritative linearizer replay.",
    "when": "PROMOTE",
    "where": "controller linearizer + promotion",
    "who": "xtrl runner",
    "why": "Ensure promotion decisions are deterministic and replayable."
  },
  "repo": "xtrl",
  "schema_version": "xtrl.pre_contract/v0.2"
}
