{
  "schema_version": "xtrl.pre_contract/v0.2",
  "packet_id": "pkt-loop-0005-promote-patch-based",
  "component": "xtrl",
  "repo": "xtrl",
  "base_ref": "origin/main",
  "mode": "NORMAL",
  "budgets": {
    "time_minutes": 45,
    "iteration_budget": 2,
    "diff_budget": {
      "max_files_changed": 30,
      "max_lines_changed": 900
    }
  },
  "constraints": {
    "clean_repo_required": true,
    "deny_repo_local_roots": [
      ".codex",
      ".quint"
    ],
    "allowed_paths": [
      "tools/**",
      "docs/**",
      "control/**"
    ],
    "forbidden_paths": [
      ".git/**"
    ],
    "forbidden_patterns": [
      "git\\s+submodule",
      "subprocess\\.run\\(.*shell\\s*=\\s*True",
      "os\\.system\\(",
      "eval\\(",
      "exec\\("
    ]
  },
  "actions": {
    "test": [
      "python",
      "-m",
      "pytest",
      "-q",
      "--junitxml",
      "evidence/tests.junit.xml"
    ]
  },
  "evidence": {
    "required_files": [
      "evidence/plan.md",
      "evidence/decision.md",
      "evidence/scope.json",
      "evidence/integrity.json",
      "evidence/tests.junit.xml",
      "evidence/regression.md",
      "evidence/events.jsonl",
      "commands.log",
      "summary.md",
      "packet.json",
      "contract.json",
      "exec-prompt.md"
    ]
  },
  "plan_card": {
    "why": "Guarantee promotion determinism and prevent worktree-state contamination.",
    "what": "Implement promotion as: worktree diff -> patch -> apply to clean trunk -> one promoted commit -> FF-only push.",
    "how": "Controller builds patch artifact, verifies apply cleanly, creates one commit with required trailers, pushes fast-forward only.",
    "where": "tools/promotion/* and controller promote step",
    "who": "controller",
    "when": "PROMOTE"
  },
  "inputs": {
    "notes": [
      "Deny binary diffs and submodules during promotion.",
      "Enforce promoted commit policy: Conventional Commit types + Packet/Evidence trailers (as you already defined).",
      "Promotion must be single-commit, patch-based, FF-only."
    ]
  }
}
