{
  "schema_version": "xtrl.pre_contract/v0.2",
  "packet_id": "pkt-loop-0006-ledger-and-latest-state",
  "component": "xtrl",
  "repo": "xtrl",
  "base_ref": "origin/main",
  "mode": "NORMAL",
  "budgets": {
    "time_minutes": 45,
    "iteration_budget": 2,
    "diff_budget": {
      "max_files_changed": 25,
      "max_lines_changed": 800
    }
  },
  "constraints": {
    "clean_repo_required": true,
    "deny_repo_local_roots": [
      ".codex",
      ".quint"
    ],
    "allowed_paths": [
      "tools/**",
      "docs/**",
      "control/**"
    ],
    "forbidden_paths": [
      ".git/**"
    ],
    "forbidden_patterns": [
      "subprocess\\.run\\(.*shell\\s*=\\s*True",
      "os\\.system\\(",
      "eval\\(",
      "exec\\("
    ]
  },
  "actions": {
    "test": [
      "python",
      "-m",
      "pytest",
      "-q",
      "--junitxml",
      "evidence/tests.junit.xml"
    ]
  },
  "evidence": {
    "required_files": [
      "evidence/plan.md",
      "evidence/decision.md",
      "evidence/scope.json",
      "evidence/integrity.json",
      "evidence/tests.junit.xml",
      "evidence/regression.md",
      "evidence/events.jsonl",
      "commands.log",
      "summary.md",
      "packet.json",
      "contract.json",
      "exec-prompt.md"
    ]
  },
  "plan_card": {
    "why": "Eliminate thread drift and make 'current state' queryable and deterministic.",
    "what": "Append ledger events per tick and write a canonical state/latest.json pointer snapshot after each GATE.",
    "how": "ledger.jsonl append-only under $CODEX_STATE/xtrl/ledger; latest.json includes last decision, out_dir, next base_ref, run ids.",
    "where": "controller post-GATE",
    "who": "controller",
    "when": "GATE -> (write ledger + latest snapshot)"
  },
  "inputs": {
    "notes": [
      "Ledger is SSOT for runtime state; latest.json is the minimal hydration artifact for PLAN prompts and humans.",
      "Include trace_id/span_id fields later when OTEL is enabled (optional)."
    ]
  }
}
