{
  "schema_version": "xtrl.pre_contract/v0.2",
  "packet_id": "pkt-loop-0007-describe-state-git-snapshot",
  "component": "xtrl",
  "repo": "xtrl",
  "base_ref": "origin/main",
  "mode": "loop",
  "budgets": {
    "time_minutes": 45,
    "iteration_budget": 2,
    "diff_budget": { "max_files_changed": 30, "max_lines_changed": 900 }
  },
  "constraints": {
    "clean_repo_required": true,
    "deny_repo_local_roots": [".codex", ".quint"],
    "allowed_paths": [
      "tools/**",
      "control/**",
      "schemas/**",
      "docs/**",
      "README.md"
    ],
    "forbidden_paths": [".git/**"],
    "forbidden_patterns": [
      "subprocess\\.run\\(.*shell\\s*=\\s*True",
      "os\\.system\\(",
      "eval\\(",
      "exec\\("
    ]
  },
  "actions": {
    "test": ["python", "-m", "pytest", "-q", "--junitxml", "evidence/tests.junit.xml"]
  },
  "evidence": {
    "required_files": [
      "evidence/plan.md",
      "evidence/decision.md",
      "evidence/scope.json",
      "evidence/integrity.json",
      "evidence/tests.junit.xml",
      "evidence/regression.md",
      "evidence/events.jsonl",
      "evidence/state_space.json",
      "evidence/state_space.md",
      "commands.log",
      "summary.md",
      "packet.json",
      "contract.json",
      "exec-prompt.md"
    ]
  },
  "plan_card": {
    "why": "Describe repo state from git only with deterministic, bounded outputs.",
    "what": "Implement describe_state: git-derived snapshot + trailers via git interpret-trailers, outputs evidence/state_space.{json,md}.",
    "how": "Read-only tool, argv-only, bounded --n, stable ordering, no writes outside evidence/.",
    "where": "tools/describe_state.py + tests; integrate into allowed actions + evidence requirements.",
    "who": "xtrl runner + validators",
    "when": "PRECHECK + CHECK"
  },
  "inputs": {
    "notes": [
      "Use git rev-parse --show-toplevel and git log <ref> -n N for history.",
      "Parse trailers via git interpret-trailers --parse using full body %B.",
      "Enforce 1 <= --n <= 200; reject >200.",
      "Write only to ./evidence/state_space.json and ./evidence/state_space.md.",
      "Keep output deterministic (stable key ordering + stable commit ordering)."
    ]
  }
}
