{
  "actions": {
    "describe_state": [
      "python",
      "tools/describe_state.py",
      "--base-ref",
      "origin/main",
      "--n",
      "50"
    ],
    "test": [
      "python",
      "-m",
      "pytest",
      "-q",
      "--junitxml",
      "evidence/tests.junit.xml"
    ]
  },
  "base_ref": "origin/main",
  "budgets": {
    "diff_budget": {
      "max_files_changed": 30,
      "max_lines_changed": 900
    },
    "iteration_budget": 2,
    "time_minutes": 45
  },
  "component": "xtrl",
  "constraints": {
    "allowed_paths": [
      "**"
    ],
    "clean_repo_required": true,
    "deny_repo_local_roots": [
      ".codex",
      ".quint"
    ],
    "forbidden_paths": [],
    "forbidden_patterns": [
      "subprocess\\.run\\(.*shell\\s*=\\s*True",
      "os\\.system\\(",
      "eval\\(",
      "exec\\("
    ]
  },
  "evidence": {
    "required_files": [
      "evidence/plan.md",
      "evidence/decision.md",
      "evidence/scope.json",
      "evidence/integrity.json",
      "evidence/tests.junit.xml",
      "evidence/regression.md",
      "evidence/events.jsonl",
      "evidence/state_space.json",
      "evidence/state_space.md",
      "commands.log",
      "summary.md",
      "packet.json",
      "contract.json",
      "exec-prompt.md"
    ]
  },
  "inputs": {
    "notes": [
      "Use git rev-parse --show-toplevel and git log <ref> -n N for history.",
      "Parse trailers via git interpret-trailers --parse using full body %B.",
      "Enforce 1 <= --n <= 200; reject >200.",
      "Tool writes only to ./evidence/state_space.{json,md}; runner may emit commands.log/summary.md/packet.json/contract.json.",
      "Keep output deterministic (stable key ordering + stable commit ordering)."
    ]
  },
  "mode": "loop",
  "packet_id": "pkt-loop-0007-describe-state-git-snapshot",
  "plan_card": {
    "how": "Read-only tool, argv-only, bounded --n, stable ordering; tool writes only under evidence/, runner emits wrapper files.",
    "what": "Implement describe_state: git-derived snapshot + trailers via git interpret-trailers, outputs evidence/state_space.{json,md}.",
    "when": "PRECHECK + CHECK",
    "where": "tools/describe_state.py + tests; integrate into allowed actions + evidence requirements.",
    "who": "xtrl runner + validators",
    "why": "Describe repo state from git only with deterministic, bounded outputs."
  },
  "repo": "xtrl",
  "schema_version": "xtrl.pre_contract/v0.2"
}
